{
  "local_only_hashes": [
    {
      "field": "customer_names",
      "sha256": "b5e2e3e37f620b21a1ed79bfbb32977565f0e25d9b25b36da339bcd6768b8d2e"
    },
    {
      "field": "file_tree",
      "sha256": "7f5b1294d82be877957e7c14f4bfdad6188f40a90c6ff9e9b92a7ad588a0bb45"
    },
    {
      "field": "internal_architecture_notes",
      "sha256": "ad4d2973f230c1c1fd84e45481b34144d348620742ec588ee8d12242bb7fae97"
    },
    {
      "field": "product_direction",
      "sha256": "a8fdb2d44b9dde757da2f79b91ee5cfcbc90aebe654e201082114f4aa0dee22b"
    },
    {
      "field": "repo_name",
      "sha256": "7aedb978e89d5a3bb9e4764d1e9b95ba77c4ab86be1dc4176c35e295f3b426bd"
    },
    {
      "field": "roadmap",
      "sha256": "ac8c2eb0ebf3e95ceff9c661cdc3b521de587d9038c8a77defcb1007bf50713d"
    },
    {
      "field": "secret_like_values",
      "sha256": "d7942587c721470b58898b99de15c500e4f159f85cf52206c2ccc0d3bc0348e5"
    }
  ],
  "masking_level": "guided_curated_p0",
  "max_single_provider_exposure": 0.999999,
  "no_single_provider_saw_full": true,
  "policy_id": "apl-oss-demo-policy",
  "prev_receipt_hash": null,
  "provenance": {
    "apl_sidecar_version": "0.1.0-draft",
    "created_at": "2026-07-10T06:00:22Z",
    "example_id": "01_private_code_context",
    "policy_version": "0.1.0-draft",
    "receipt_schema_version": "0.1.0-draft"
  },
  "provider_events": [
    {
      "event_type": "mock_response",
      "payload_chars": 526,
      "payload_sha256": "6c95fab5d72c6ddf0bd5c65b6d14406833e79198186cb72ab736fddbef849ec2",
      "provider_id": "mock_provider_a",
      "response_sha256": "0b5174ba8b2e09140b8a1fc5e69d88932b834a8662f253b98fbabe33839b675f"
    },
    {
      "event_type": "mock_response",
      "payload_chars": 496,
      "payload_sha256": "73010f25da0eb8706d92f8774e3baaf5f03f7bc0dffc435df1f4f035bcbd012f",
      "provider_id": "mock_provider_b",
      "response_sha256": "6914e978b3935d3466d4476017f99c99740a0603641e226af0f20add8d512790"
    }
  ],
  "receipt_hash": "270f72427e4b7a6639a49e8305bd95ea92a7c2b2cc72c553078d0414ab117ba6",
  "run_id": "01KX59SR04SNWG9TC0RR6GTAHH",
  "signature": {
    "alg": "Ed25519",
    "value": "xzQvCiO4N8zbW4iPz4YQgmeJNIwtDN5JHZBNXdxogL5ZWtOH7kTfZeO8KaO0G5uZ06CYUoUlNHFG/0T3jBzlCQ=="
  },
  "signing_key_id": "apl-oss-demo-key",
  "single_provider_exposure": [
    {
      "exposure_ratio": 0.34628,
      "provider_id": "mock_provider_a"
    },
    {
      "exposure_ratio": 0.326531,
      "provider_id": "mock_provider_b"
    }
  ],
  "task_type": "private_code_context"
}
